{
  "query_id": "QPATH-028",
  "root": "r",
  "root_bound": {
    "assurance": {
      "depends_on": [
        "source:r",
        "sol:bound/relation/v1"
      ],
      "evidence": [
        "source:r"
      ],
      "stale": false,
      "status": "contract_asserted"
    },
    "bound_rule": "sol:bound/relation/v1",
    "guarantee": "bounded",
    "intervals": [],
    "lower": {
      "fields": [
        {
          "name": "id",
          "nullable": false,
          "type": "i64"
        },
        {
          "name": "name",
          "nullable": false,
          "type": "string"
        }
      ],
      "tuples": [
        [
          1,
          "a"
        ]
      ]
    },
    "lower_object": null,
    "may_be_empty_groups": [],
    "order": [],
    "provenance": {
      "lower_membership_mode": "why",
      "lower_memberships": [
        {
          "cites": [
            "source:r"
          ],
          "mode": "why",
          "tuple": [
            1,
            "a"
          ]
        }
      ],
      "upper_derivation": {
        "evaluators": [],
        "input_relations": [],
        "rewrites": [],
        "rule_id": "sol:bound/relation/v1",
        "sources": [
          "source:r"
        ],
        "view_substitutions": []
      }
    },
    "result_object": null,
    "upper": {
      "fields": [
        {
          "name": "id",
          "nullable": false,
          "type": "i64"
        },
        {
          "name": "name",
          "nullable": false,
          "type": "string"
        }
      ],
      "tuples": [
        [
          1,
          "a"
        ],
        [
          2,
          "b"
        ],
        [
          3,
          "c"
        ]
      ]
    },
    "upper_object": null
  },
  "schema_version": "qry.bounds.v0.3"
}
