{
  "query_id": "QGOLD-007",
  "root": "d",
  "root_bound": {
    "assurance": {
      "depends_on": [
        "sol:bound/difference/v1",
        "source:a",
        "source:b"
      ],
      "evidence": [
        "source:a",
        "source:b"
      ],
      "stale": false,
      "status": "contract_asserted"
    },
    "bound_rule": "sol:bound/difference/v1",
    "guarantee": "bounded",
    "intervals": [],
    "lower": {
      "fields": [
        {
          "name": "v",
          "nullable": false,
          "type": "i64"
        }
      ],
      "tuples": [
        [
          1
        ]
      ]
    },
    "lower_object": "object:sha256:c1034cca2c5916dbf1d8db5a931c8d4d05997dff383e6dec95624815f9dd6080",
    "may_be_empty_groups": [],
    "order": [],
    "provenance": {
      "lower_membership_mode": "tuple",
      "lower_memberships": [
        {
          "cites": [],
          "mode": "tuple",
          "tuple": [
            1
          ]
        }
      ],
      "upper_derivation": {
        "evaluators": [],
        "input_relations": [
          "object:sha256:2244eb8723e61eddc65fa8511504da1498200e15b78cae86b4028fa1dea77405",
          "object:sha256:8669487ab94ffc52cbf93a69fdd71b438407bcef37daced07a7b7fd4576b3412",
          "object:sha256:e0489483db4ede4409376383b7cb0f4fdd126950b84b1bcc6a6a1593dbdbab23",
          "object:sha256:ec5a721b7c2273e57afd06faf854b19cd325b44595279f927f121e7b3b31a512"
        ],
        "rewrites": [],
        "rule_id": "sol:bound/difference/v1",
        "sources": [
          "source:a",
          "source:b"
        ],
        "view_substitutions": []
      }
    },
    "result_object": null,
    "upper": {
      "fields": [
        {
          "name": "v",
          "nullable": false,
          "type": "i64"
        }
      ],
      "tuples": [
        [
          1
        ],
        [
          3
        ]
      ]
    },
    "upper_object": "object:sha256:7c9798c56e51a175782c5d10785bbdace8fa352b8d8318d6c4a18861bccbb0de"
  },
  "schema_version": "qry.bounds.v0.3"
}
